{
  "artifact_id": "TENDER-23-CNCCC-FW-GK-1347-01",
  "doc_type": "招标文件",
  "title": "信科公司基于海油发展大数据平台的数据应用、分析系统的开发及运营服务单项协议",
  "tender_id": "23-CNCCC-FW-GK-1347/01",
  "issue_date": "2023-06-01",
  "edited_at": "2026-09-21",
  "status": "draft",
  "buyer": {
    "name": "中海油能源发展股份有限公司",
    "agent": "中化建国际招标有限责任公司"
  },
  "meta": {
    "funding": "企业自筹",
    "method": "公开招标",
    "qualification_mode": "资格后审",
    "estimate_cny_wan": 1200,
    "service_period_announced": "3年",
    "service_period_sow": "24个月",
    "service_locations": [
      "北京",
      "天津"
    ],
    "bid_deadline": "2023-06-16T09:00:00+08:00",
    "sale_start": "2023-06-01T09:00:00+08:00",
    "sale_end": "2023-06-06T17:00:00+08:00",
    "bid_bond_cny": 300000,
    "performance_bond_ratio": 0.15,
    "vat_rate": 0.06,
    "accept_consortium": false,
    "allow_subcontract": false
  },
  "chapters": [
    {
      "id": "ch01",
      "title": "第一章 招标公告",
      "sections": [
        {
          "heading": "1. 项目概况",
          "body_md": "项目名称：信科公司基于海油发展大数据平台的数据应用、分析系统的开发及运营服务单项协议\n\n招标编号：23-CNCCC-FW-GK-1347/01\n\n资金来源：企业自筹，已落实。\n\n采购方式：公开招标；资格审查方式：资格后审。\n\n**服务期：3 年**（自合同签订之日起计算）。\n\n**服务地点：北京市朝阳区创达三路 1 号院。**\n\n招标项目估算价：人民币 **1200 万元**（含税）。\n\n服务地址：北京、天津。\n\n招标文件发售时间：**2023-06-01 09:00 至 2023-06-06 17:00**，标书费人民币 200 元，售后不退。\n\n招标文件通过中国海洋石油集团有限公司采办业务管理与交易系统发售。"
        },
        {
          "heading": "2. 招标范围",
          "body_md": "本项目招标范围包括数据分析服务、数据开发服务、数据可视化服务、数据运营服务、数据安全与平台保障服务五类数据服务，总工作量 30,900 人天（详见第五章分项报价表与第六章任务大纲）。"
        },
        {
          "heading": "3. 投标人资格要求",
          "body_md": "1、投标人应为在中华人民共和国境内依法注册的独立法人，具有独立承担民事责任的能力，营业执照登记状态为存续。\n\n2、投标人应具有良好的商业信誉和健全的财务会计制度，近三年内经营活动中无重大违法记录。\n\n3、业绩证明文件至少包括：合同首页、签字盖章页、服务内容清单、验收证明文件或（财务）结算清单。未提供上述全部材料的，视为无效业绩。年度协议业绩除提供年度协议外，还应至少提供 1 项已完成订单的订单页及订单相应的验收证明文件或（财务）结算清单。\n\n4、**投标人须在天津市内设有经工商登记的分支机构或常设服务机构，并提供该机构不少于 10 名常驻人员的近六个月社保缴纳记录**，否则资格审查不合格。\n\n5、**投标人近三年内应具有中国海油系统内数据应用或分析系统开发服务业绩，每提供 1 项系统内业绩加 2 分，最高加 6 分**，业绩证明材料要求同第 3 条。\n\n6、本项目**不接受**联合体投标，**不允许**分包。"
        },
        {
          "heading": "4. 招标文件的澄清与修改",
          "body_md": "投标人如对招标文件有异议，应当在投标截止时间 **5 日前**以书面形式向招标人提出，招标人将在收到异议后 2 个工作日内作出答复。"
        },
        {
          "heading": "5. 投标文件的递交",
          "body_md": "投标文件递交截止时间：**2023 年 6 月 16 日 9:00**（北京时间）。招标文件自 2023 年 6 月 1 日起在中国海洋石油集团有限公司采办业务管理与交易系统发售。\n\n开标时间：2023-06-16 09:00；开标地点：在线开标（中国海洋石油集团有限公司采办业务管理与交易系统）。\n\n投标有效期：自投标截止之日起 120 日。"
        }
      ]
    },
    {
      "id": "ch02",
      "title": "第二章 投标人须知",
      "sections": [
        {
          "heading": "投标资料表",
          "body_md": "| 条款号 | 条款名称 | 规定内容 |\n| --- | --- | --- |\n| 1.5 | 联合体投标 | 本项目**不接受**联合体投标。 |\n| 1.7 | 投标人不得存在的情形 | 投标人应具有良好的商业信誉，**未被列入国家有关失信名单**，并出具加盖公章的书面承诺。 |\n| 1.7.4 | 否决投标情形清单 | 投标人不得存在下列情形之一：（1）为招标人不具有独立法人资格的附属机构（单位）；（2）为本标段前期准备提供设计或咨询服务的；（3）为本标段的监理人；（4）为本标段的代建人；（5）为本标段提供招标代理服务的。 |\n| 1.11 | 投标有效期 | 120 日。 |\n| 2 | 投标文件的编制 | 投标文件应编制目录与页码，**正本 1 份、副本 4 份**，电子版 1 份随投标文件一并提交。 |\n| 2.1 | 招标文件的澄清与修改 | 投标人如对招标文件有异议，**应当在投标截止时间 5 日前**以书面形式向招标人提出，招标人将在收到异议后 2 个工作日内作出答复。 |\n| 3.3 | 最高投标限价 | 无。 |\n| 3.4 | 投标保证金 | 投标保证金金额：**人民币 30 万元**，投标人须在投标截止时间前从其基本账户以银行电汇方式足额递交。 （注：招标项目估算价为人民币 1200 万元；按估算价的 2% 计算的保证金上限为人民币 **24 万元**。） |\n| 3.6 | 履约担保 | 履约担保金额：**中标合同金额的 15%**，合同签订前以银行履约保函形式提交。 |\n| 3.7 | 价格评分 | 评标基准价为所有有效评标价格的最低价。投标人评标价格高于基准价的，每高于 1% 减 **0.25 分**，不足 1% 按直线内插，保留 2 位小数（第 3 位四舍五入）。本项目增值税率固定为 6%。 |\n| 3.9 | 付款方式 | 本合同**无预付款**，服务费用按季度据实结算，每季度结束后 30 日内支付。 |\n| 4.1 | 评标结果公示 | 4.1 **评标结束后，招标人依法确定中标人并发出中标通知书。** |\n| 4.2 | 中标通知书 | 中标人确定后，招标人向中标人发出中标通知书，并同时将中标结果通知所有未中标的投标人。 |"
        },
        {
          "heading": "1. 总则",
          "body_md": "1.1 本招标文件包括第一章至第七章及其全部附件。\n\n1.2 投标人应仔细阅读招标文件全部内容，未按招标文件要求编制的投标文件将被否决。"
        },
        {
          "heading": "2. 投标文件的编制",
          "body_md": "2.1 投标文件由商务文件、技术文件、价格文件三册组成，应按第五章规定的格式、内容和顺序编制，**不得缺项**。\n\n2.2 **正本 1 份、副本 4 份**，电子版 1 份随投标文件一并提交。"
        },
        {
          "heading": "3. 投标报价",
          "body_md": "3.1 投标人应按第六章任务大纲规定的五类服务分项报价，并填报增值税税率。\n\n3.2 投标报价应为完成本项目全部工作内容所需的全部费用。"
        }
      ]
    },
    {
      "id": "ch03",
      "title": "第三章 评标办法",
      "sections": [
        {
          "heading": "(引言)",
          "body_md": "本项目采用**综合评估法**。"
        },
        {
          "heading": "评标办法前附表",
          "body_md": "> **本表格中标注「★」的条款，如与招标文件（包括附件）中相同内容的条款有矛盾，以本表中规定为准。**\n\n### 3.a) 符合性检查（形式评审）\n\n| 序号 | 检查项 | 检查标准 |\n| --- | --- | --- |\n| 1 | ★投标人名称 | 投标人名称应与营业执照一致。 |\n| 2 | ★投标文件签署 | 投标文件应按招标文件要求由法定代表人（或授权代表）签字并加盖单位章；由授权代表签署的，应附法定代表人签署的授权委托书原件。 |\n| 3 | ★投标文件格式 | 投标文件应按第五章规定的格式、内容和顺序编制，**不得缺项**。 |\n| 4 | ★报价唯一 | 投标人不得递交任何可选择报价或两个及以上报价；开标一览表与投标报价汇总表的报价应当一致。 |\n| 5 | ★报价文件特征码 | 若发现不同投标人在采办信息系统上「报价文件特征码」环节里「**文件制作机器码、文件创建标识码和 MAC 地址**」中的**任何一类内容一致时**，**否决所有涉及投标人的投标**。 |\n| 6 | ★投标保证金 | 投标保证金金额为人民币 **30 万元**；**须自投标人基本账户以银行电汇方式递交，不接受第三方代缴**；须在投标截止时间前足额到账。 |\n| 7 | ★联合体投标 | 本项目**不接受**联合体投标。 |\n| 8 | ★分包 | 本项目**不允许**分包。 |\n\n**投标人存在相互串通投标情形的，其投标将被否决。**\n\n### 3.b) 资格评审\n\n| 序号 | 资格项 | 资格标准 |\n| --- | --- | --- |\n| 1 | ★营业执照 | 投标人应具有有效的营业执照，登记状态为存续，经营范围覆盖本次招标标的。 |\n| 2 | ★业绩要求1 | 投标人应提供 2020 年 1 月 1 日起、单项合同金额不低于人民币 300 万元的已完成数据服务类业绩**至少 2 项**，并按本表规定提交业绩材料。 |\n| 3 | ★业绩要求2 | 投标人拟派项目组应满足第六章任务大纲「二）2. 配备资源要求」的全部人员数量与岗位要求，并提供投标截止日前 3 个月的本公司人员社保证明。 |\n| 4 | ★信誉要求 | （1）不得被各级法院中列入失信被执行人名单；（2）不得被列入严重违法失信企业名单（黑名单）；（3）营业执照不得被吊销、注销；（4）供应商档案状态不得为「违规冻结」，「品类受控」且受控品类与本次招标相关的亦不得通过。 |\n| 5 | ★保密要求 | 投标人应提交加盖单位章的《保密承诺书》，**未提交的按资格评审不通过处理**。 |\n| 6 | ★知识产权要求 | 投标人应提交《知识产权承诺书》，承诺本项目形成的所有数据、模型、代码、文档等知识产权归招标人所有。 |\n| 7 | ★投标文件要求 | 投标人的资质、业绩信息应在开标阶段于采办业务管理与交易系统作公开信息响应，**未公开的在评标阶段不予认可，即使投标文件中提供了也不认可**。 |\n| 8 | ★驻场要求 | **项目组所有服务人员须全部驻场**，投标人应提交《驻场服务承诺函》，承诺范围未涵盖全部服务人员的视为不满足。 |\n\n资格评审的业绩要求：投标人应按本表规定提交业绩材料，**评标委员会仅对投标文件所附业绩材料进行评审**。\n\n### 3.c) 商务技术评议（100 分）\n\n| 序号 | 评审项 | 分值 | 评审标准 |\n| --- | --- | --- | --- |\n| 1 | 财务报表 | 2 | 提供近三年经审计的财务报表的得 2 分，否则得 0 分。 |\n| 2 | 既往业绩 | 3 | 单项合同金额 **≥500 万元得 3 分**；**≥300 万元且 <500 万元得 1 分**；**<300 万元不得分**。按金额最高的一项计，最高 3 分。业绩认定窗口为 2020 年 1 月 1 日起。 |\n| 3 | 证书 | 5 | 每提供 1 类有效资质证书得 1 分，最高 5 分。证书过期的，按未提供该子项处理。 |\n| 4 | 软件著作权 | 10 | 每类软著得 1 分、同类最多 2 分，最高 10 分；著作权人须为投标人自身。 |\n| 5 | 五类服务方案 | 25 | 数据分析、数据开发、数据可视化、数据运营、数据安全与平台保障五类服务方案各 5 分。 |\n| 6 | 项目负责人 | 6 | 须提供 1 名**自有**项目负责人的身份证、职称证书、PMP 或高级信息系统项目管理师证书、及投标截止日前 3 个月的本公司人员社保证明。**所提供的人员不允许兼职。** |\n| 7 | 高级数据分析工程师 | 6 | 须提供不少于 **2 名**自有高级数据分析工程师及相应证明材料。**所提供的人员不允许兼职。** |\n| 8 | 数据分析工程师 | 6 | 须提供不少于 3 名自有数据分析工程师及相应证明材料。**所提供的人员不允许兼职。** |\n| 9 | 高级数据开发工程师 | 3 | 须提供不少于 3 名自有高级数据开发工程师及相应证明材料。**所提供的人员不允许兼职。** |\n| 10 | 数据开发工程师 | 3 | 须提供不少于 3 名自有数据开发工程师及相应证明材料。**所提供的人员不允许兼职。** |\n| 11 | 高级数据运维工程师 | 3 | 须提供不少于 3 名自有高级数据运维工程师及相应证明材料。**所提供的人员不允许兼职。** |\n| 12 | 数据运维工程师 | 3 | 须提供不少于 3 名自有数据运维工程师及相应证明材料。**所提供的人员不允许兼职。** |\n| 13 | 服务要求 | 20 | 对第六章任务大纲「三）服务要求」与「三）服务交付物」逐条响应，存在实质性负偏离或缺项的不得分。 |\n| 14 | 售后服务及培训 | 5 | 提供不少于 40 人天的培训方案及课程大纲，覆盖数据平台使用、数据开发规范、运维操作三类内容。 |\n\n**商务技术评分满分为 100.0 分。**\n\n### 3.d) 价格评议\n\n| 序号 | 评审项 | 评审标准 |\n| --- | --- | --- |\n| 1 | 评标基准价 | 所有有效评标价格的最低价。 |\n| 2 | 偏差率 | δ = 100% ×（投标人评标价 − 评标基准价）÷ 评标基准价。 |\n| 3 | 扣分规则 | 每高于评标基准价 1% 减 0.25 分，不足 1% 按直线内插，保留 2 位小数（第 3 位四舍五入）。 |\n| 4 | ★税费偏离调整 | 因投标人为小规模纳税人发生不同投标人报价税率不一致的，按「税率偏离调整 = 投标价格（不含增值税）× （所有合格报价中税率最高值 − 所报增值税率）× 附加税税率（12%）」调整评标价格。 |\n| 5 | ★投标报价有算术错误修正 | （1）大写金额与小写金额不一致的，**以大写金额为准**；（2）单价与数量的乘积与总价不一致的，以单价为准；（3）总价金额与按单价汇总金额不一致的，以单价汇总金额为准；（4）不同文字文本的报价不一致的，以中文文本为准。修正结果须经投标人书面澄清确认，**拒不澄清确认的应当否决其投标**。 |\n| 6 | ★低于成本报价 | 投标报价明显低于其他投标报价，使得其投标报价可能低于其成本的，**应当要求该投标人作出书面说明并提供相应的证明材料**；投标人不能合理说明或者不能提供相应证明材料的，认定其以低于成本报价竞标并否决其投标。本项目未设最高投标限价，不适用超限判定。 |\n\n### 3.e) 评分汇总\n\n综合评分 = 商务技术评分 × 50% + 价格评分 × 50%。"
        },
        {
          "heading": "2. 评标委员会",
          "body_md": "评标委员会由 **5 人组成，其中招标人代表 3 人、技术经济专家 2 人**，由招标人依法确定，与投标人有利害关系的人员应当主动回避。"
        },
        {
          "heading": "（二）3. 评审标准",
          "body_md": "### 价格评议\n\n评标基准价为所有有效评标价格中的最低价。投标人的评标价格高于评标基准价的，每高于评标基准价的 1%，减 **0.5 分**，不足 1% 的按直线内插，保留 2 位小数（第 3 位四舍五入）。\n\n评标价格不含增值税。存在税费偏离的，按前附表 3.d) 第 4 项调整后作为评标价格参与比较。\n\n**商务技术评分满分为 100.0 分。**"
        }
      ]
    },
    {
      "id": "ch04",
      "title": "第四章 投标人资格标准",
      "sections": [
        {
          "heading": "(引言)",
          "body_md": "| 序号 | 资格标准 | 要求 |\n| --- | --- | --- |\n| 1 | ★营业执照 | 具有有效的营业执照，登记状态为存续，经营范围覆盖本次招标标的。 |\n| 2 | ★业绩要求1 | 2020 年 1 月 1 日起、**单项合同金额不低于人民币 300 万元**的已完成数据服务类业绩**至少 2 项**。 |\n| 3 | ★业绩要求2 | 拟派项目组满足任务大纲「二）2. 配备资源要求」的全部人员数量与岗位要求，并提供本公司人员社保证明。 |\n| 4 | ★信誉要求 | 未被列入失信被执行人名单、严重违法失信企业名单；营业执照未被吊销、注销；供应商档案状态合规。 |\n| 5 | ★保密要求 | 提交加盖单位章的《保密承诺书》。 |\n| 6 | ★知识产权要求 | 提交《知识产权承诺书》。 |\n| 7 | ★投标文件要求 | 资质、业绩信息应在开标阶段于采办系统公开。 |\n| 8 | ★驻场要求 | 提交《驻场服务承诺函》，项目组所有服务人员须全部驻场。 |\n\n上述 8 项资格标准中任何一项不满足的，资格审查不通过。"
        }
      ]
    },
    {
      "id": "ch05",
      "title": "第五章 投标文件标准格式",
      "sections": [
        {
          "heading": "(引言)",
          "body_md": "投标人应按本章规定的格式、内容和顺序编制投标文件。**正本 1 份、副本 2 份**，电子版 1 份随投标文件一并提交。"
        },
        {
          "heading": "第一部分 商务文件",
          "body_md": "1. 投标文件递交函\n\n2. 法定代表人授权委托书\n\n3. 投标保证金缴纳证明\n\n4. 投标人的机构\n\n4.1 投标人信息表\n\n4.2 营业执照\n\n4.3 资质证书\n\n4.4 软件著作权\n\n4.5 财务报告\n\n4.6 进行中的服务工作\n\n5. 投标人的经验\n\n5.1 一般服务项目业绩\n\n6. 人员组成和成员任务\n\n7. 提名的关键人员简历\n\n8. 人员时间计划表\n\n9. 工作计划表\n\n10. 投标人的设备投入\n\n11. 合同条款响应表\n\n12. 保密承诺书\n\n13. 知识产权承诺书\n\n14. 驻场服务承诺函\n\n15. 信誉情况\n\n16. 评分索引表"
        },
        {
          "heading": "第二部分 技术文件",
          "body_md": "1. 项目理解\n\n2. 技术方案\n\n3. 数据架构设计\n\n4. 数据安全与平台保障服务\n\n5. 数据开发服务\n\n6. 项目管理\n\n7. 服务要求响应表\n\n8. 交付物清单\n\n9. 项目进度计划\n\n10. 售后服务及培训"
        },
        {
          "heading": "第三部分 价格文件",
          "body_md": "1. 价格投标文件函\n\n2. 开标一览表\n\n3. 投标报价汇总表\n\n4. 行项目报价\n\n5. 分项报价表\n\n3、业绩证明文件至少包括：合同首页、签字盖章页、服务内容清单、验收证明文件或（财务）结算清单，**以及与该合同对应的增值税发票复印件（发票金额须与合同金额一致）**。未提供上述全部材料的，视为无效业绩。\n\n13.3 **供应商绿色环保承诺书（如涉及）**；13.4 股权证明文件；13.5 服务方案。投标文件应按本章目录及顺序编制并编制页码。"
        }
      ]
    },
    {
      "id": "ch06",
      "title": "第六章 任务大纲",
      "sections": [
        {
          "heading": "一、项目概况及总体要求",
          "body_md": "本项目为信科公司基于海油发展大数据平台的数据应用、分析系统的开发及运营服务，采用单项协议方式采购，\n**服务期：自合同签订之日起 24 个月**。\n\n服务地址：北京、天津。"
        },